{
  "schema_version": "1.0",
  "key_column": "id",
  "columns": [
    "id",
    "name",
    "role"
  ],
  "summary": {
    "before_rows": 3,
    "after_rows": 3,
    "added": 1,
    "removed": 1,
    "changed": 1,
    "unchanged": 1
  },
  "added": [
    {
      "id": "004",
      "name": "Jo",
      "role": "PM"
    }
  ],
  "removed": [
    {
      "id": "003",
      "name": "Sam",
      "role": "Writer"
    }
  ],
  "changed": [
    {
      "key": "001",
      "before": {
        "id": "001",
        "name": "Ada",
        "role": "Engineer"
      },
      "after": {
        "id": "001",
        "name": "Ada",
        "role": "Lead"
      },
      "changed_columns": [
        "role"
      ]
    }
  ]
}
